{
  "schema": "audioprep.package-contract.v1",
  "design_revision": "R2.1.5.07",
  "name": "audioprep-worker",
  "layer": 6,
  "depends_on": [
    "audioprep-contracts",
    "audioprep-artifacts",
    "audioprep-pipeline"
  ],
  "responsibility": "Isolated process protocol, cancellation, timeout and result envelopes.",
  "public_surface": [
    "WorkerRequest",
    "WorkerResultEnvelope",
    "WorkerSupervisor"
  ],
  "must_not": [
    "writing the primary SQLite database",
    "choosing policy branches"
  ],
  "maturity": "PLANNING_ONLY",
  "repository_model": "single-monorepo-unified-version"
}
