{
  "schema": "audioprep.package-contract.v1",
  "design_revision": "R2.1.5.07",
  "name": "audioprep-artifacts",
  "layer": 3,
  "depends_on": [
    "audioprep-contracts",
    "audioprep-store"
  ],
  "responsibility": "CAS byte storage, Artifact occurrences, strong references and garbage collection.",
  "public_surface": [
    "CasStore",
    "ArtifactOccurrence",
    "ArtifactReference",
    "GcPlanner"
  ],
  "must_not": [
    "workflow scheduling",
    "audio interpretation"
  ],
  "maturity": "PLANNING_ONLY",
  "repository_model": "single-monorepo-unified-version"
}
