{
  "schema": "audioprep.package-contract.v1",
  "design_revision": "R2.1.5.07",
  "name": "audioprep-vad",
  "layer": 8,
  "depends_on": [
    "audioprep-audio-io",
    "audioprep-worker"
  ],
  "responsibility": "Voice activity detection nodes and speech interval artifacts.",
  "public_surface": [
    "VadNodeSpec",
    "SpeechIntervals"
  ],
  "must_not": [
    "final delivery publication",
    "control-plane writes"
  ],
  "maturity": "PLANNING_ONLY",
  "repository_model": "single-monorepo-unified-version"
}
