{
  "schema": "audioprep.package-contract.v1",
  "design_revision": "R2.1.5.07",
  "name": "audioprep-decisions",
  "layer": 7,
  "depends_on": [
    "audioprep-store",
    "audioprep-pipeline",
    "audioprep-artifacts"
  ],
  "responsibility": "Candidate joins, policy evaluation and one-time Decision resolution.",
  "public_surface": [
    "DecisionService",
    "DecisionPolicy",
    "CandidateJoin"
  ],
  "must_not": [
    "executing workers",
    "rewriting historical artifacts"
  ],
  "maturity": "PLANNING_ONLY",
  "repository_model": "single-monorepo-unified-version"
}
